<?xml version="1.0" encoding="UTF-8"?>
<!DOCTYPE root [<!ELEMENT root ANY><!ELEMENT item ANY><!ATTLIST item ID ID #REQUIRED><!ATTLIST item Explanation CDATA #IMPLIED>]><root>
<item ID="APPPATH">D:/wls3.5.8_all_in_one_2/Apache2.2/htdocs</item>
<item ID="IL8N">zh-CN</item>
<item ID="DB_TYPE">mysql</item>
<item ID="DB_HOST">localhost:3371</item>
<item ID="DB_NAME">exam</item>
<item ID="DB_USERNAME">root</item>
<item ID="DB_PASSWORD"></item>
<item ID="DB_CHARSET">UTF-8</item>
<item ID="DB_URL" Explanation="only in java need this"><![CDATA[jdbc:sqlite://localhost:3306/myapp?user=root&password=null]]></item>
<item ID="MODE">independent</item>
<item ID="GIS_GUEST_CENTER" Explanation="if guest open the map , the default center">28.466579,119.922241â€Ž</item>
<item ID="ZONE" Explanation="see GB2260 , China-Standard">330281</item>
<item ID="GROUP_REG">50</item>
<item ID="reLoad">donothing</item>
</root>